
__Cleaning Up A Dirty 'place_of_receipt' column__


imports=# SELECT place_of_receipt, count(place_of_receipt) FROM bol_la_2018 GROUP BY place_of_receipt ORDER BY count DESC LIMIT 10;
 place_of_receipt | count
------------------+--------
 YANTIAN          | 264391
 SHANGHAI         | 151865
 XIAMEN           | 125469
 HONG KONG        |  96206
 NINGBO           |  93126
 HO CHI MINH CITY |  44066
 LAEM CHABANG     |  42545
 YANTIAN, CHINA   |  38670
 YANTIAN, CN      |  35169
 KAOHSIUNG        |  34800
(10 rows)

# found a shit spot in the data, 3 Yantian appearances in the top 10 alone
# and 31 rows beginning with 'YANTIAN'

#create a new column with all 31 values to default YANTIAN
# regex expression to

UPDATE bol_la_2015
SET place_of_receipt = 'YANTIAN'
WHERE place_of_receipt LIKE '%YANTIAN%' ;
# UPDATE 506511

imports=# SELECT distinct(place_of_receipt) FROM bol_la_2018 WHERE place_of_receipt LIKE 'YANTIAN%' ;
 place_of_receipt
-------------------
 YANTIAN SEHNZHEN
 YANTIAN, CHINA MA
 YANTIAN,GUANGDONG
 YANTIAN, PC
 YANTIAN,44,CN
 YANTIAN CN
 YANTIAN, CHINA
 YANTIAN SHENZHEN
 YANTIAN,CHIAN
 YANTIAN - CY
 YANTIAN GD
 YANTIAN
 YANTIAN,
 YANTIAN,SHENZHEN,
 YANTIAN,CHINA
 YANTIAN,SHENZHEN
 YANTIAN,CN
 YANTIAN, CN
 YANTIAN,CFS
 YANTIAN,GD
 YANTIAN CFS
 YANTIAN ,CHINA
 YANTIAN,GD,PRC
 YANTIAN,CA
 YANTIAN, SHENZHEN
 YANTIAN, GUANGDON
 YANTIAN, CHINA M
 YANTIAN.CHINA
 YANTIAN,GD,CHINA
 YANTIAN PT
 YANTIAN CHINA

 place_of_receipt | count
 ------------------+--------
  YANTIAN          | 506511
  SHANGHAI         | 151865
  XIAMEN           | 125469
  HONG KONG        |  96206
  NINGBO           |  93126
  HO CHI MINH CITY |  44066
  LAEM CHABANG     |  42545
  KAOHSIUNG        |  34800
  JAKARTA          |  33869
  HAIPHONG         |  32694
 (10 rows)



 # SHANGHAI has 38
 UPDATE bol_la_2018
 SET place_of_receipt = 'SHANGHAI'
 WHERE place_of_receipt LIKE '%SHANGHAI%' ;

 # UPDATE 302669

 place_of_receipt | count
 ------------------+--------
  YANTIAN          | 506511
  SHANGHAI         | 302669
  XIAMEN           | 125469
  HONG KONG        |  96206
  NINGBO           |  93126
  HO CHI MINH CITY |  44066
  LAEM CHABANG     |  42545
  KAOHSIUNG        |  34800
  JAKARTA          |  33869
  HAIPHONG         |  32694
 (10 rows)

## 33 for XIAMEN

 UPDATE bol_la_2018                                                                                                       SET place_of_receipt = 'XIAMEN'
 WHERE place_of_receipt LIKE '%XIAMEN%' ;

 # UPDATE 203712

 ## 19 HONG KONG
 UPDATE bol_la_2018                                                                                                       SET place_of_receipt = 'HONG KONG'
 WHERE place_of_receipt LIKE '%HONG KONG%' ;
 # UPDATE 119856

 ## 41 NINGBO
 UPDATE bol_la_2018                                                                                                       SET place_of_receipt = 'NINGBO'
 WHERE place_of_receipt LIKE '%NINGBO%' ;
# UPDATE 190361

## Lots of Ho Chi Minh CITY

## LAEM Chabang

SELECT place_of_receipt, count(place_of_receipt)
FROM bol_la_2017
GROUP BY place_of_receipt
HAVING count(place_of_receipt) BETWEEN 16000 AND 500;

SELECT *
FROM bol_la_2017
WHERE place_of_receipt = 'HK'
LIMIT 2;

HK                |  3281
 HKHKG

 UPDATE bol_la_2018
 SET place_of_receipt = 'HONG KONG'
 WHERE place_of_receipt LIKE 'HK' ;

 CNDLC             |  1175
 CNFOC             |  2344
 CNNGB             |  6401
 CNTAO             |  8649
 CNTXG             |  1378
 CNXMN             |  4652

 UPDATE bol_la_2017
  SET place_of_receipt = 'KAOHSIUNG'
  WHERE place_of_receipt LIKE 'TWKHH' ;

### copy final counts to a CSV

/Users/michaelweber/enigma
Copy (SELECT place_of_receipt, count(place_of_receipt)
FROM bol_la_2018 GROUP BY place_of_receipt
ORDER BY count DESC)
To '/Users/michaelweber/enigma/place_of_receipt.csv' With CSV DELIMITER ',';
COPY 4339

Copy (SELECT place_of_receipt, count(place_of_receipt) FROM bol_la_2018) To '/Users/michaelweber/enigma/place_of_receipt.csv' With CSV DELIMITER ',';
